,리뷰,메뉴
0,후라이드는 살짝 덜 바삭해서 아쉬웠고 양념도 적은듯하니 그나마 간장치킨은 괜찮았어요 담엔 케이준치킨으로 시켜 먹어보려구요,불변의 법칙 두마리 3가지맛（후라이드＋양념＋간장）/1(치킨 선택(오리지널))
1,맛있어서 또시켰어요~ 떡볶이 매운도 못먹는 사람도 잘 먹네용 셋이 먹으면 딱이에요,만땅 떡볶이세트（순살후라이드＋모듬 해산물＋떡볶이）/1(음료 사이즈 업(콜라 1.25L로 변경))
2,헐대박 여기너무 괜찮아요 떡볶이와 치킨을 드뎌 같이 먹을수있게 되고 튀김 또한 퀄리티 개쩜 자주시켜먹을듯!!!!!!깨악 떡볶이 진짜 핵 존맛탱,만땅 떡볶이세트（순살후라이드＋모듬 해산물＋떡볶이）/1(음료 사이즈 업(콜라 1.25L로 변경))
3,지난번에는 또띠아세트 먹었는데 오늘 쉬림프케이준세트도 역시 맛있네요. 특히 후라이드가 맛있어요. 먹기전에 찍었어야하는데 다 먹고서야 생각이 났네요. 사업 번창하세요.,쉬림프케이준 두마리 3가지맛（후라이드＋케이준샐러드＋양념새우）/1
4,따봉 오만 개.....,"쉬림프케이준 두마리 3가지맛（후라이드＋케이준샐러드＋양념새우）/1,불변의 법칙 한마리 2가지맛（후라이드or양념 or 간장）/1(맛 선택(간장,후라이드),치킨 선택(오리지널))"
5,처음 시켰습니다. 너무 맛있어서 사진 찍지도 못하고 거의 먹었네요^^ 맛있게 잘 먹었습니다.,멕시코리따（순살후라이드＋순살양념＋샐러드＋또띠아）/1
6,맛있었어요 구스구스,요거베리굿 두마리 3가지맛（후라이드＋요거트샐러드＋오징어깐풍）/1
7,배달 진짜 엄청 오래걸리네요 배달원은 거의 던지듯 주고가고 기분 참.. 오래 기다려서 그런가 맛도 더럽게 없게 느껴지네요 다시는 안시킵니다.,"쉬림프케이준 한마리 2가지맛（후라이드or케이준샐러드 or 양념새우）/1(맛 선택(케이준샐러드,양념새우))"
8,이집 맛나네 괜찮네 굿,불변의 법칙 두마리 3가지맛（후라이드＋양념＋간장）/1(치킨 선택(오리지널))
9,굿굿굿굿굿굿굿굿굿굿,"불변의 법칙 두마리 3가지맛（후라이드＋양념＋간장）/1(치킨 선택(오리지널)),치즈시즈닝/1,양념소스/1"
10,깐풍치킨이랑 떡볶이 시켰어요. 튀김옷도 바삭하고 맛있었어요~^^,"북경깐풍치킨/1(치킨 선택(오리지널)),국물떡볶이/1"
11,양은 많은대 소스가 별로라 다음에 시킬 의향 없네요,쉬림프케이준 두마리 3가지맛（후라이드＋케이준샐러드＋양념새우）/1(음료 사이즈 업(콜라 1.25L로 변경))
12,깔끔하고 맛있어요.,만땅 떡볶이세트（순살후라이드＋모듬 해산물＋떡볶이）/1
13,후라이드가 신선하고 간장소스치킨이랑 양념치킨도 맛있어요,"불변의 법칙 두마리 3가지맛（후라이드＋양념＋간장）/1(치킨 선택(오리지널),음료 사이즈 업(콜라 1.25L로 변경))"
14,치킨집인데 떡볶이가 넘 맛잇었어요ㅠㅜ....오징어튀김은 튀김이 아니구 그냥 좀 그랬구ㅠㅠ...치킨은 가슴살 좋아하시는분들은 좋아하실거같아요 흑흑 떡볶이는 다시 시켜먹어보고싶은 맛이에요 ㅋ.ㅋ,만땅 떡볶이세트（순살후라이드＋모듬 해산물＋떡볶이）/1(음료 사이즈 업(콜라 1.25L로 변경))
15,맛있어요 맛있어요~,쉬림프케이준 두마리 3가지맛（후라이드＋케이준샐러드＋양념새우）/1
16,아이들이 좋아해서 또 먹었네요,그린나이트 두마리 3가지맛（후라이드＋와사비샐러드＋문어깐풍）/1
17,항상 맛있게 먹고있네요,그린나이트 두마리 3가지맛（후라이드＋와사비샐러드＋문어깐풍）/1
18,엄청 맛있었어요 ^^ 배달도 매우 빨리 왔어요,쉬림프케이준 두마리 3가지맛（후라이드＋케이준샐러드＋양념새우）/1
19,좋아요 배달빠르고 양 풍족...,베이비할리퀸 두마리 3가지맛（후라이드＋할라피뇨샐러드＋꽃게간장）/1
20,Gooooooood,"쉬림프케이준 두마리 3가지맛（후라이드＋케이준샐러드＋양념새우）/1(음료 사이즈 업(콜라 1.25L로 변경)),국물떡볶이/1"
21,치킨 시즈닝 뿌렸더니 너무 행복했어요ㅠㅠㅠㅠ 강정도 맛있는데 양념 좀만 달달한거 뿌리면 더 맛있을거 같아용! 잘먹었습니담,"쉬림프케이준 한마리 2가지맛（후라이드or케이준샐러드 or 양념새우）/1(맛 선택(양념새우,후라이드)),치즈시즈닝/1"
22,배달빠르고 맛있고 최고였어요~!!,베이비할리퀸 두마리 3가지맛（후라이드＋할라피뇨샐러드＋꽃게간장）/1
23,치킨도 바삭하고 시즈닝뿌려먹으니 딱 좋더라고요~ 양이 많아서 다음날 먹었는데도 식어도 맛있는 치킨이더라고요ㅎ 재구매의사 있습니다.,"베이비할리퀸 한마리 2가지맛（후라이드or할라피뇨샐러드or꽃게간장）/1(맛 선택(할라피뇨샐러드,꽃게간장))"
24,늘 믿고 먹어요 배달료가 아쉽지만 맛납니다,불변의 법칙 두마리 3가지맛（후라이드＋양념＋간장）/1(치킨 선택(오리지널))
25,원래 깐풍기가 먹고 싶었는데 집 주변이 다 닫아서 깜풍치킨으로 주문해봤습니다. 제가 생각한 맛은 전혀아니었구 뭔가 간장치킨맛이 나더라구요ㅜㅜ 생각한 맛은 아니었지만 맛있었습니다! 그리고 생각없이 시킨 국물떡볶이....제 원픽입니다. 일단 달달한 떡볶이구 전 떡보다 어묵파라 어묵많이 들어서 좋았구 안에 당면?이 좀 있더라그요. 배우신분들....싹싹 비웠습니다.,"북경깐풍치킨/1(치킨 선택(오리지널)),국물떡볶이/1"
26,약간 퍽퍽한 거 빼곤 다 좋아써요 단골될거가탱♡,불변의 법칙 두마리 3가지맛（후라이드＋양념＋간장）/1(치킨 선택(순살))
27,처음시켜봤는데 양 푸짐하고 맛있네요~^^,쉬림프케이준 두마리 3가지맛（후라이드＋케이준샐러드＋양념새우）/1(음료 사이즈 업(콜라 1.25L로 변경))
28,잘먹엇습니당ㅎㅎㅎㅎ,쉬림프케이준 두마리 3가지맛（후라이드＋케이준샐러드＋양념새우）/1(음료 사이즈 업(콜라 1.25L로 변경))
29,케이준샐러드때문에 시킨건데 진심 존맛탱!!! 너무 좋았어요~^^ 양념치킨도 너무 맛있어요~ 잘먹었습니다!!^^,"쉬림프케이준 한마리 2가지맛（후라이드or케이준샐러드 or 양념새우）/1(맛 선택(케이준샐러드,양념새우))"
30,말이 필요없습니다!!!!,쉬림프케이준 두마리 3가지맛（후라이드＋케이준샐러드＋양념새우）/1
31,맛있다.......,"쉬림프케이준 두마리 3가지맛（후라이드＋케이준샐러드＋양념새우）/1(음료 사이즈 업(콜라 1.25L로 변경)),국물떡볶이/1"
32,엄청 맛있슴다 담에 또 시켜먹어야겠어용,
